{"$schema":"https://json-schema.org/draft/2020-12/schema","$id":"mem0_capability_bom.schema.json","title":"Mem0 capability BOM","type":"object","additionalProperties":false,"required":["schema_version","capability","status","version","runtime","model","license_summary","requires_gpu"],"$defs":{"digest":{"type":"string","pattern":"^[0-9a-f]{64}$"},"revision":{"type":"string","pattern":"^[0-9a-f]{40}$"},"source_pair":{"type":"object","additionalProperties":false,"required":["mirror","official"],"properties":{"mirror":{"type":"string","format":"uri","pattern":"^https://"},"official":{"type":"string","format":"uri","pattern":"^https://"}}},"revision_pair":{"type":"object","additionalProperties":false,"required":["mirror","official"],"properties":{"mirror":{"$ref":"#/$defs/revision"},"official":{"$ref":"#/$defs/revision"}}}},"properties":{"schema_version":{"const":"olivia.capability-bom.v1"},"capability":{"const":"long_term_memory"},"status":{"const":"FIXED"},"version":{"type":"string","minLength":1},"license_summary":{"type":"string","minLength":1},"requires_gpu":{"const":false},"runtime":{"type":"object","additionalProperties":false,"required":["artifact_id","canonical_source","requirements","artifacts","requirements_sha256","package_count","download_size_bytes","license","redistributable","required","target","install_mode","status","pypi_sources"],"properties":{"artifact_id":{"const":"mem0-runtime-windows-cp312"},"canonical_source":{"const":"https://pypi.org/simple"},"requirements":{"const":"installer/mem0-runtime-requirements.txt"},"artifacts":{"const":"installer/mem0-runtime-artifacts.json"},"requirements_sha256":{"$ref":"#/$defs/digest"},"package_count":{"const":69},"download_size_bytes":{"type":"integer","minimum":1},"license":{"type":"string","minLength":1},"redistributable":{"const":false},"required":{"const":false},"target":{"const":"runtime/mem0-site-packages"},"install_mode":{"const":"on_demand"},"status":{"const":"FIXED"},"pypi_sources":{"$ref":"#/$defs/source_pair"}}},"model":{"type":"object","additionalProperties":false,"required":["artifact_id","canonical_source","repo_id","revision","license","redistributable","required","target","install_mode","status","sources","source_revisions","files"],"properties":{"artifact_id":{"const":"BAAI/bge-small-zh-v1.5"},"canonical_source":{"const":"https://huggingface.co/BAAI/bge-small-zh-v1.5"},"repo_id":{"const":"BAAI/bge-small-zh-v1.5"},"revision":{"$ref":"#/$defs/revision"},"license":{"const":"MIT"},"redistributable":{"const":true},"required":{"const":false},"target":{"const":"data/memory/model-cache"},"install_mode":{"const":"on_demand"},"status":{"const":"FIXED"},"sources":{"$ref":"#/$defs/source_pair"},"source_revisions":{"$ref":"#/$defs/revision_pair"},"files":{"type":"object","minProperties":10,"maxProperties":10,"additionalProperties":{"type":"object","additionalProperties":false,"required":["size_bytes","sha256"],"properties":{"size_bytes":{"type":"integer","minimum":1},"sha256":{"$ref":"#/$defs/digest"}}}}}}}}